{
  "$schema": "https://json-schema.org/draft/2020-12/schema",
  "$id": "https://github.com/sappho192/ffxiv-hermes/raw/main/schemas/hermes-v2.schema.json",
  "title": "Hermes v2 runtime manifest",
  "type": "object",
  "additionalProperties": false,
  "required": [
    "schemaVersion",
    "compatibility",
    "source",
    "platform",
    "roots",
    "resources",
    "validation"
  ],
  "properties": {
    "schemaVersion": { "const": 2 },
    "compatibility": {
      "type": "object",
      "additionalProperties": false,
      "required": ["minimumSharlayanVersion", "pointerResolverVersion"],
      "properties": {
        "minimumSharlayanVersion": { "$ref": "#/$defs/semver" },
        "pointerResolverVersion": { "const": 1 }
      }
    },
    "source": {
      "type": "object",
      "additionalProperties": false,
      "required": [
        "fcsRepository",
        "fcsCommit",
        "generatorRepository",
        "generatorCommit"
      ],
      "properties": {
        "fcsRepository": {
          "const": "https://github.com/aers/FFXIVClientStructs.git"
        },
        "fcsCommit": { "$ref": "#/$defs/gitSha" },
        "generatorRepository": {
          "const": "https://github.com/sappho192/ffxiv-hermes.git"
        },
        "generatorCommit": { "$ref": "#/$defs/gitSha" }
      }
    },
    "platform": {
      "type": "object",
      "additionalProperties": false,
      "required": ["process", "architecture"],
      "properties": {
        "process": { "const": "ffxiv_dx11.exe" },
        "architecture": { "const": "x64" }
      }
    },
    "roots": {
      "type": "object",
      "additionalProperties": false,
      "required": ["framework"],
      "properties": {
        "framework": { "$ref": "#/$defs/root" }
      }
    },
    "resources": {
      "type": "object",
      "additionalProperties": false,
      "required": ["chatLog", "talk", "currentTalk"],
      "properties": {
        "chatLog": {
          "type": "object",
          "additionalProperties": false,
          "required": [
            "root",
            "uiModuleOffset",
            "raptureLogModuleOffset",
            "indexVectorOffset",
            "dataVectorOffset"
          ],
          "properties": {
            "root": { "const": "framework" },
            "uiModuleOffset": { "$ref": "#/$defs/offset" },
            "raptureLogModuleOffset": { "$ref": "#/$defs/offset" },
            "indexVectorOffset": { "$ref": "#/$defs/offset" },
            "dataVectorOffset": { "$ref": "#/$defs/offset" }
          }
        },
        "talk": {
          "type": "object",
          "additionalProperties": false,
          "required": [
            "root",
            "semantics",
            "uiModuleOffset",
            "nameOffset",
            "textOffset",
            "utf8String"
          ],
          "properties": {
            "root": { "const": "framework" },
            "semantics": { "const": "lastStandardTalk" },
            "uiModuleOffset": { "$ref": "#/$defs/offset" },
            "nameOffset": { "$ref": "#/$defs/offset" },
            "textOffset": { "$ref": "#/$defs/offset" },
            "utf8String": {
              "type": "object",
              "additionalProperties": false,
              "required": [
                "stringPointerOffset",
                "bufferUsedOffset",
                "lengthSource"
              ],
              "properties": {
                "stringPointerOffset": { "$ref": "#/$defs/offset" },
                "bufferUsedOffset": { "$ref": "#/$defs/offset" },
                "lengthSource": { "const": "bufferUsedMinusNull" }
              }
            }
          }
        },
        "currentTalk": {
          "type": "object",
          "additionalProperties": false,
          "required": [
            "root",
            "semantics",
            "uiModuleOffset",
            "raptureAtkModuleOffset",
            "raptureAtkUnitManagerOffset",
            "allLoadedUnitsListOffset",
            "atkUnitList",
            "atkUnitBase",
            "atkValue",
            "addonName",
            "textValueIndex",
            "nameValueIndex"
          ],
          "properties": {
            "root": { "const": "framework" },
            "semantics": { "const": "currentStandardTalk" },
            "uiModuleOffset": { "$ref": "#/$defs/offset" },
            "raptureAtkModuleOffset": { "$ref": "#/$defs/offset" },
            "raptureAtkUnitManagerOffset": { "$ref": "#/$defs/offset" },
            "allLoadedUnitsListOffset": { "$ref": "#/$defs/offset" },
            "atkUnitList": {
              "type": "object",
              "additionalProperties": false,
              "required": [
                "entriesOffset",
                "countOffset",
                "capacity",
                "entrySize"
              ],
              "properties": {
                "entriesOffset": { "$ref": "#/$defs/offset" },
                "countOffset": { "$ref": "#/$defs/offset" },
                "capacity": {
                  "type": "integer",
                  "minimum": 1,
                  "maximum": 4096
                },
                "entrySize": { "const": 8 }
              }
            },
            "atkUnitBase": {
              "type": "object",
              "additionalProperties": false,
              "required": [
                "nameOffset",
                "nameCapacity",
                "visibilityStateOffset",
                "visibilityMask",
                "readinessOffset",
                "readinessMask",
                "atkValuesPointerOffset",
                "atkValuesCountOffset"
              ],
              "properties": {
                "nameOffset": { "$ref": "#/$defs/offset" },
                "nameCapacity": {
                  "type": "integer",
                  "minimum": 1,
                  "maximum": 256
                },
                "visibilityStateOffset": { "$ref": "#/$defs/offset" },
                "visibilityMask": { "$ref": "#/$defs/mask" },
                "readinessOffset": { "$ref": "#/$defs/offset" },
                "readinessMask": { "$ref": "#/$defs/mask" },
                "atkValuesPointerOffset": { "$ref": "#/$defs/offset" },
                "atkValuesCountOffset": { "$ref": "#/$defs/offset" }
              }
            },
            "atkValue": {
              "type": "object",
              "additionalProperties": false,
              "required": [
                "size",
                "typeOffset",
                "valueOffset",
                "allowedStringTypes"
              ],
              "properties": {
                "size": { "type": "integer", "minimum": 1, "maximum": 256 },
                "typeOffset": { "$ref": "#/$defs/offset" },
                "valueOffset": { "$ref": "#/$defs/offset" },
                "allowedStringTypes": { "const": [40] }
              }
            },
            "addonName": { "const": "Talk" },
            "textValueIndex": { "const": 0 },
            "nameValueIndex": { "const": 1 }
          }
        },
        "battleTalk": {
          "type": "object",
          "additionalProperties": false,
          "required": [
            "root",
            "semantics",
            "uiModuleOffset",
            "raptureAtkModuleOffset",
            "raptureAtkUnitManagerOffset",
            "allLoadedUnitsListOffset",
            "atkUnitList",
            "addon",
            "addonName",
            "atkArrayDataHolderOffset",
            "arrayDataHolder",
            "arrayData",
            "numberValuesOffset",
            "stringValuesOffset",
            "numberArrayId",
            "stringArrayId",
            "visibleIndex",
            "nameIndex",
            "textIndex",
            "sequenceSemantics"
          ],
          "properties": {
            "root": { "const": "framework" },
            "semantics": { "const": "currentBattleTalk" },
            "uiModuleOffset": { "$ref": "#/$defs/offset" },
            "raptureAtkModuleOffset": { "$ref": "#/$defs/offset" },
            "raptureAtkUnitManagerOffset": { "$ref": "#/$defs/offset" },
            "allLoadedUnitsListOffset": { "$ref": "#/$defs/offset" },
            "atkUnitList": { "$ref": "#/$defs/atkUnitList" },
            "addon": { "$ref": "#/$defs/addonVisibility" },
            "addonName": { "const": "_BattleTalk" },
            "atkArrayDataHolderOffset": { "$ref": "#/$defs/offset" },
            "arrayDataHolder": { "$ref": "#/$defs/atkArrayDataHolder" },
            "arrayData": { "$ref": "#/$defs/atkArrayData" },
            "numberValuesOffset": { "$ref": "#/$defs/offset" },
            "stringValuesOffset": { "$ref": "#/$defs/offset" },
            "numberArrayId": { "const": 38 },
            "stringArrayId": { "const": 35 },
            "visibleIndex": { "const": 0 },
            "nameIndex": { "const": 0 },
            "textIndex": { "const": 1 },
            "sequenceSemantics": { "const": "visibilityOrContentGeneration" }
          }
        }
      }
    },
    "validation": {
      "oneOf": [
        {
          "type": "object",
          "additionalProperties": false,
          "required": ["status"],
          "properties": { "status": { "const": "candidate" } }
        },
        {
          "type": "object",
          "additionalProperties": false,
          "required": [
            "status",
            "gameVersion",
            "executableSha256",
            "verifierCommit"
          ],
          "properties": {
            "status": { "const": "live-verified" },
            "gameVersion": {
              "type": "string",
              "minLength": 1,
              "maxLength": 64
            },
            "executableSha256": { "$ref": "#/$defs/sha256" },
            "verifierCommit": { "$ref": "#/$defs/gitSha" }
          }
        }
      ]
    }
  },
  "$defs": {
    "gitSha": { "type": "string", "pattern": "^[0-9a-f]{40}$" },
    "sha256": { "type": "string", "pattern": "^[0-9a-f]{64}$" },
    "semver": {
      "type": "string",
      "pattern": "^(0|[1-9][0-9]*)\\.(0|[1-9][0-9]*)\\.(0|[1-9][0-9]*)(?:-[0-9A-Za-z-]+(?:\\.[0-9A-Za-z-]+)*)?(?:\\+[0-9A-Za-z-]+(?:\\.[0-9A-Za-z-]+)*)?$"
    },
    "offset": { "type": "integer", "minimum": 0, "maximum": 16777216 },
    "mask": { "type": "integer", "minimum": 1, "maximum": 4294967295 },
    "atkUnitList": {
      "type": "object",
      "additionalProperties": false,
      "required": ["entriesOffset", "countOffset", "capacity", "entrySize"],
      "properties": {
        "entriesOffset": { "$ref": "#/$defs/offset" },
        "countOffset": { "$ref": "#/$defs/offset" },
        "capacity": { "type": "integer", "minimum": 1, "maximum": 4096 },
        "entrySize": { "const": 8 }
      }
    },
    "addonVisibility": {
      "type": "object",
      "additionalProperties": false,
      "required": [
        "nameOffset",
        "nameCapacity",
        "visibilityStateOffset",
        "visibilityMask",
        "readinessOffset",
        "readinessMask"
      ],
      "properties": {
        "nameOffset": { "$ref": "#/$defs/offset" },
        "nameCapacity": { "type": "integer", "minimum": 1, "maximum": 256 },
        "visibilityStateOffset": { "$ref": "#/$defs/offset" },
        "visibilityMask": { "$ref": "#/$defs/mask" },
        "readinessOffset": { "$ref": "#/$defs/offset" },
        "readinessMask": { "$ref": "#/$defs/mask" }
      }
    },
    "utf8String": {
      "type": "object",
      "additionalProperties": false,
      "required": ["stringPointerOffset", "bufferUsedOffset", "lengthSource"],
      "properties": {
        "stringPointerOffset": { "$ref": "#/$defs/offset" },
        "bufferUsedOffset": { "$ref": "#/$defs/offset" },
        "lengthSource": { "const": "bufferUsedMinusNull" }
      }
    },
    "atkArrayDataHolder": {
      "type": "object",
      "additionalProperties": false,
      "required": [
        "numberArrayCountOffset",
        "numberArraysOffset",
        "stringArrayCountOffset",
        "stringArraysOffset"
      ],
      "properties": {
        "numberArrayCountOffset": { "$ref": "#/$defs/offset" },
        "numberArraysOffset": { "$ref": "#/$defs/offset" },
        "stringArrayCountOffset": { "$ref": "#/$defs/offset" },
        "stringArraysOffset": { "$ref": "#/$defs/offset" }
      }
    },
    "atkArrayData": {
      "type": "object",
      "additionalProperties": false,
      "required": ["sizeOffset", "updateStateOffset"],
      "properties": {
        "sizeOffset": { "$ref": "#/$defs/offset" },
        "updateStateOffset": { "$ref": "#/$defs/offset" }
      }
    },
    "pattern": {
      "type": "string",
      "minLength": 2,
      "maxLength": 1024,
      "pattern": "^(?:[0-9A-F]{2}|\\?\\?)+$"
    },
    "root": {
      "type": "object",
      "additionalProperties": false,
      "required": ["pattern", "relativeFollowOffset", "isPointer"],
      "properties": {
        "pattern": { "$ref": "#/$defs/pattern" },
        "relativeFollowOffset": {
          "type": "integer",
          "minimum": 0,
          "maximum": 512
        },
        "isPointer": { "const": true }
      }
    }
  }
}
